<?xml version="1.0" encoding="UTF-8"?>
<tns:results xmlns:xsi="http://www.w3.org/2001/XMLSchema-instance"
             xmlns:tns="file://C:/Users/Dadadaniil/IdeaProjects/Java_Practice_XML_11/src/main/resources/results.xsd"
             xsi:noNamespaceSchemaLocation="results.xsd">
    <student>
        <login>cool</login>
        <tests>
            <test name="oop" date="2023-03-20" mark="8.5"/>
            <test name="xml" date="2023-03-23" mark="7.3"/>
            <test name="oop" date="2023-03-27" mark="9.4"/>
            <test name="jdbc" date="2023-03-27" mark="6.8"/>
            <test name="xml" date="2023-03-29" mark="7.9"/>
        </tests>
    </student>
    <student>
        <login>clever</login>
        <tests>
            <test name="oop" date="2023-03-27" mark="7.0"/>
            <test name="collections" date="2023-03-28" mark="6.4"/>
        </tests>
    </student>
</tns:results>
